{
  "claim_boundary": {
    "counterfactual_model_choice_equivalence": false,
    "future_action_oracle_used": false,
    "model_calls_authorized": false,
    "model_calls_observed": 0,
    "provider_native_token_claim": false,
    "recorded_instruction_sequence_replayed": true,
    "recorded_model_choices_preserved_as_inputs": true
  },
  "coverage_curve": [
    {
      "admitted_roots": 20,
      "all_valid_submissions_reconstructible": false,
      "capacity": 1,
      "capacity_unit": "non_overlapping_subtree_root",
      "coalescences": 0,
      "evictions": 15,
      "maximum_resident_roots": 1,
      "receipt_only_inspections": 38,
      "refetches": 8,
      "unsatisfied_submissions": 8
    },
    {
      "admitted_roots": 7,
      "all_valid_submissions_reconstructible": true,
      "capacity": 2,
      "capacity_unit": "non_overlapping_subtree_root",
      "coalescences": 0,
      "evictions": 0,
      "maximum_resident_roots": 2,
      "receipt_only_inspections": 43,
      "refetches": 0,
      "unsatisfied_submissions": 0
    },
    {
      "admitted_roots": 7,
      "all_valid_submissions_reconstructible": true,
      "capacity": 4,
      "capacity_unit": "non_overlapping_subtree_root",
      "coalescences": 0,
      "evictions": 0,
      "maximum_resident_roots": 2,
      "receipt_only_inspections": 43,
      "refetches": 0,
      "unsatisfied_submissions": 0
    }
  ],
  "integrity": {
    "dependencies": [
      {
        "path": "construction/matched-compacted-session-execution-freeze-v1/freeze.json",
        "sha256": "5ecf6bcc24b6f0ebc92fa1405036c036febed90beecb38e6bde0f879bd2ddc26"
      },
      {
        "path": "construction/matched-compacted-session-execution-freeze-v1/publication/artifact-lock.json",
        "sha256": "2e859fade03f6bd0c687c90d5649782178ce340e4739c8530334f340863c2bd3"
      },
      {
        "path": "observations/semantic-compacted-session-calibration-005/result.json",
        "sha256": "9ebebe55ffaea87b9013320fa9955f387b192ea67ebf54b17d7ff47c906e1b8c"
      },
      {
        "path": "observations/semantic-compacted-session-calibration-005/publication/artifact-lock.json",
        "sha256": "2cfd3655ac304e0317dbe0aef82c8a9e6bc4e7e2fb491e89fcfc4c780fb60e54"
      },
      {
        "path": "protocol/semantic-observation-churn-v1.schema.json",
        "sha256": "a1054cbffdf41962f3d86d8561f7914a69f1188844890f644b5f22b8ef1967cc"
      },
      {
        "path": "scripts/semantic_observation_churn.py",
        "sha256": "7d3687bdfe30d86b24cea6f1a0f80721734af0a9f90b3a1701053d2a426302f6"
      }
    ]
  },
  "observed_churn": {
    "inspection_calls": 49,
    "no_new_handle_calls": 43,
    "repeated_signature_calls": 30,
    "repeated_target_transfers": 128,
    "structurally_redundant_targets": 112,
    "target_transfers": 167,
    "unique_handles": 39
  },
  "observed_handle_lru": {
    "evictions": 140,
    "observation_component_bytes": 218219,
    "state_bytes": 449360,
    "subtree_state_bytes_never_covering_submission": 33922
  },
  "primary_result": {
    "admitted_roots": 7,
    "all_valid_submissions_reconstructible": true,
    "capacity": 2,
    "capacity_unit": "non_overlapping_subtree_root",
    "coalescences": 0,
    "evictions": 0,
    "maximum_resident_roots": 2,
    "observation_component_bytes": 275955,
    "observation_component_bytes_change_vs_observed_percent": 26.4578,
    "receipt_only_inspections": 43,
    "refetches": 0,
    "state_bytes": 507096,
    "state_bytes_change_vs_observed_percent": 12.8485,
    "subtree_state_bytes_never_covering_submission": 74083,
    "unsatisfied_submissions": 0
  },
  "replay": {
    "model_calls_observed": 0,
    "semantic_call_cells": 5,
    "turns": 60,
    "valid_submissions": 8
  },
  "schema_version": "ai-experiments.semantic-ir.semantic-observation-churn/v1",
  "source_observation": {
    "artifact_lock_sha256": "2cfd3655ac304e0317dbe0aef82c8a9e6bc4e7e2fb491e89fcfc4c780fb60e54",
    "path": "observations/semantic-compacted-session-calibration-005/result.json",
    "provider_requests": 124,
    "sha256": "9ebebe55ffaea87b9013320fa9955f387b192ea67ebf54b17d7ff47c906e1b8c"
  },
  "status": "local_replay_complete"
}
